image_id,image_path,category,style,material,brand,description,tags
07cddef1-1fc8-47e4-a28a-613e60912590,dress/07cddef1-1fc8-47e4-a28a-613e60912590.jpg,dress,casual,cotton,EliteEssence,A chic dress featuring contemporary fashion trends and flattering silhouette.,"dress, women's fashion, apparel, clothing, casual, versatile"
19e4de0d-fb90-47c2-83b4-37e3652c5a16,dress/19e4de0d-fb90-47c2-83b4-37e3652c5a16.jpg,dress,semi-formal,synthetic blend,FashionFinesse,"A vibrant magenta knee-length sheath dress featuring elbow-length sleeves, a round neckline, and a fitted waistline. The skirt section has subtle pleats and functional side pockets. A visible zipper closure is at the back of the neck.","dress, magenta, purple, sheath dress, cocktail dress, work dress, business casual, semi-formal, elbow sleeve, round neck, knee-length, pockets, elegant, women's fashion, fitted waist"
22ee2330-a2e7-4abf-aec1-0699e819a248,dress/22ee2330-a2e7-4abf-aec1-0699e819a248.jpg,dress,"Casual/Semi-formal (bodycon/sheath style, suitable for daywear or evening casual events)",Knit fabric (appears to be a stretch material like jersey or a similar blend),Old Navy,"A sleeveless, fitted mini dress featuring a vibrant and intricate abstract kaleidoscopic pattern. The design incorporates symmetrical motifs in black, light purple, white, and subtle hints of red/orange, creating a dynamic visual effect. It is a bodycon or sheath style dress, likely made from a comfortable stretch knit fabric.","sleeveless dress, mini dress, bodycon dress, sheath dress, abstract pattern, kaleidoscope pattern, geometric pattern, multi-color, casual dress, party dress, womens fashion, knit dress, stretch dress, summer dress, fitted dress"
24890459-3da7-4976-a837-f289e7af0d48,dress/24890459-3da7-4976-a837-f289e7af0d48.jpg,dress,A-line,chiffon,EliteElegance,A versatile dress that can be dressed up or down for different occasions.,"dress, women's fashion, apparel, clothing, casual, versatile"
35f5fecb-755a-45d6-ac3d-3feb8299dc87,dress/35f5fecb-755a-45d6-ac3d-3feb8299dc87.jpg,dress,wrap,denim,FashionFiesta,A versatile dress that can be dressed up or down for different occasions.,"dress, women's fashion, apparel, clothing, casual, versatile"
3eeaf330-2460-4d7f-844f-d7254d12e587,dress/3eeaf330-2460-4d7f-844f-d7254d12e587.jpg,dress,wrap,denim,ChicBoutique,"A stylish dress perfect for various occasions, featuring contemporary design and comfortable fit.","dress, women's fashion, apparel, clothing, casual, versatile"
4114a9c0-eea0-442c-af14-8df6c586a016,dress/4114a9c0-eea0-442c-af14-8df6c586a016.jpg,dress,Casual,Knit cotton,Bee Happy Bella,"A casual, sleeveless dress featuring a full-length front zipper and a V-neck. It has horizontal stripes in navy blue, red, and white. The right side is decorated with red umbrella appliques/embroidery. It also features two large, curved red patch pockets on the sides.","casual dress, striped dress, navy blue, red, white, sleeveless, zipper front, umbrella print, summer dress, beach cover-up, house dress, knit dress, comfortable"
465ff2a7-d489-45c6-a97e-561ba597da54,dress/465ff2a7-d489-45c6-a97e-561ba597da54.jpg,dress,Casual,"Not explicitly visible, likely a woven fabric like cotton or a blend, with a satin-like lining at the neckline.",BoutiqueBliss,"A stylish navy blue casual dress adorned with a charming all-over white butterfly print. It features a wide/scoop neckline and short, cuffed sleeves, suggesting a comfortable and versatile fit, possibly a shift or A-line style.","dress, navy blue, white, butterfly print, short sleeve, cuffed sleeves, casual, shift dress, patterned, women's fashion, spring, summer, day dress"
46e4c390-2154-4f6f-8c6f-e7805564d929,dress/46e4c390-2154-4f6f-8c6f-e7805564d929.jpg,dress,Casual,Lightweight fabric,ChicBoutique,"A casual, sleeveless dress featuring a drawstring neckline, adorned with a repeating abstract pattern of circular motifs in varying shades of blue and white/light grey. The dress has a relaxed, flowy silhouette.","dress, casual dress, summer dress, blue, white, patterned, abstract pattern, circular pattern, mandala print, sleeveless, drawstring neckline, women's fashion"
4719349a-06d4-4ddf-8428-69c6cef55e46,dress/4719349a-06d4-4ddf-8428-69c6cef55e46.jpg,dress,Casual/Playful (Children's dress),"Cotton blend (top), Tulle (skirt)",mywear,"A children's long-sleeve dress featuring a white top with a vibrant rainbow graphic and 'I wish...' text, paired with a layered lavender tulle skirt. The skirt has delicate white unicorn and cloud patterns peeking through the sheer fabric.","Children's dress, Long-sleeve, Rainbow, Unicorn, Tulle skirt, Purple, White, Casual, Playful, Graphic print, Mywear"
475d03c5-3317-4877-b13d-e2142b33bb70,dress/475d03c5-3317-4877-b13d-e2142b33bb70.jpg,dress,Casual,Knit blend,FashionFusion,"A casual short-sleeved top featuring black raglan sleeves and a rounded neckline. The main body of the top is dark grey or black with an intricate pattern of light grey and white flowers, stars, and abstract swirls. Some areas of the pattern also include small geometric dot clusters.","casual, top, shirt, blouse, short-sleeve, floral pattern, grey, black, white, women's fashion, everyday wear, raglan sleeve"
5ab0c815-c152-4726-b540-42876b23c34a,dress/5ab0c815-c152-4726-b540-42876b23c34a.jpg,dress,wrap,denim,UrbanThreads,"An elegant dress with modern styling, suitable for casual and semi-formal events.","dress, women's fashion, apparel, clothing, casual, versatile"
6ccb3f12-7087-4303-a522-3a76d3db8ce6,dress/6ccb3f12-7087-4303-a522-3a76d3db8ce6.jpg,dress,casual,cotton,EliteElegance,"An elegant dress with modern styling, suitable for casual and semi-formal events.","dress, women's fashion, apparel, clothing, casual, versatile"
7a80fe51-8dfd-4e62-a65a-b192365731fa,dress/7a80fe51-8dfd-4e62-a65a-b192365731fa.jpg,dress,Casual,Unidentifiable (appears to be a woven fabric or blend),Zara,"A casual black dress featuring 3/4 sleeves, a round neckline, and a playful scattered print of small maroon and white hearts/dots. The dress has a fitted bodice and a slightly flared skirt with subtle pleating, making it suitable for everyday wear or semi-casual occasions.","dress, mini dress, 3/4 sleeve, heart print, dot print, black dress, maroon, white, casual dress, women's fashion, Zara"
835a1782-1eaf-41f3-9d5f-232161f4db53,dress/835a1782-1eaf-41f3-9d5f-232161f4db53.jpg,dress,Casual,Lightweight Woven Fabric (likely rayon or viscose blend),EliteEssence,A dark teal/deep green casual dress or long tunic featuring a charming white/light-colored floral and bird print. It has long sleeves with elasticated cuffs and subtle ruffle detailing across the upper chest/shoulders.,"casual dress, tunic, floral print, bird print, long sleeve, ruffle detail, dark green, teal, women's fashion, everyday wear"
881c62dc-a47a-444d-86b7-93a27b431f51,dress/881c62dc-a47a-444d-86b7-93a27b431f51.jpg,dress,A-line,chiffon,BoutiqueBeauty,"A fashionable dress designed for everyday wear, combining style and comfort.","dress, women's fashion, apparel, clothing, casual, versatile"
9044c1d9-92ae-42aa-adee-4aeb468f6d5b,dress/9044c1d9-92ae-42aa-adee-4aeb468f6d5b.jpg,dress,"Casual, Feminine",Lightweight woven fabric,StyleSense,"A light pink, long-sleeved dress with a ruffled high collar and a smocked bodice, adorned with a whimsical novelty print of various fashion and accessory items in red, brown, and gold tones. The dress has a relaxed, flowy silhouette below the smocked waist.","dress, long sleeve, pink, smocked, ruffled collar, novelty print, fashion print, accessory print, casual dress, feminine, flowy, lightweight, women's dress"
92f5cc49-20c0-4b60-a206-9f26e4b736a7,dress/92f5cc49-20c0-4b60-a206-9f26e4b736a7.jpg,dress,Smart Casual,"Soft, flowy fabric",ZARA,"A long-sleeved tunic dress in a solid dusty rose color. It features a sophisticated keyhole neckline, cuffed sleeves with button details, and a modern curved hem. The fabric appears soft and drapes elegantly, making it suitable for a variety of smart casual occasions.","dress, tunic, long sleeve, dusty rose, mauve, terracotta, keyhole neckline, cuffed sleeves, curved hem, shift dress, casual, flowy, soft fabric, women's fashion, blouse dress, versatile"
937e2c8f-500e-44fa-b2dc-e5e769e7c5a2,dress/937e2c8f-500e-44fa-b2dc-e5e769e7c5a2.jpg,dress,casual,Textured fabric,ClassicCouture,"A short-sleeved dress in a vibrant teal/aqua color with a round neckline. It features an intricate white damask-style pattern, which is more concentrated on the bodice and hem, creating a gradient effect towards the waist. The fabric appears textured, possibly a jacquard weave.","dress, short sleeve, round neck, teal, aqua, blue, white pattern, damask, baroque, ornate, textured, casual dress, summer dress, spring dress, mini dress, a-line, fit and flare"
974964a0-77cc-47b3-a54f-57eea90bb3fe,dress/974964a0-77cc-47b3-a54f-57eea90bb3fe.jpg,dress,Casual,Lightweight woven fabric,StyleSymphony,"A light pink long-sleeved dress featuring a detailed multi-colored floral pattern. The dress has a tie-waist design and is made from a lightweight, flowy fabric, suitable for casual wear.","floral print, midi dress, maxi dress, long sleeve, tie-waist, casual dress, summer dress, spring dress, women's fashion, patterned dress, flowy fabric"
a65dc730-f117-4a1a-8fe9-917fad90a167,dress/a65dc730-f117-4a1a-8fe9-917fad90a167.jpg,dress,cocktail,silk,UrbanElite,A chic dress featuring contemporary fashion trends and flattering silhouette.,"dress, women's fashion, apparel, clothing, casual, versatile"
b2f77e73-5ae0-49ca-bb0e-aaad215bcd8f,dress/b2f77e73-5ae0-49ca-bb0e-aaad215bcd8f.jpg,dress,Casual,"Crochet, Crinkled fabric, Lace trim",BY VERO MINI (Vero Moda Mini),"A vibrant fuchsia pink sleeveless dress for children, featuring a delicate crochet-knit bodice, a gathered waist, and a flowy tiered skirt made of a crinkled fabric. The skirt tiers are accented with matching lace trim, adding a charming detail. It comes with its original tag, indicating it is new.","fuchsia dress, pink dress, sleeveless dress, crochet top, lace trim, tiered skirt, ruffled dress, children's dress, girls dress, baby dress, new with tags, casual dress, summer dress, Vero Moda Mini, crinkled fabric"
b5c9449f-f1fe-4b81-a247-329145b6c277,dress/b5c9449f-f1fe-4b81-a247-329145b6c277.jpg,dress,Casual,Knit,EliteEssence,"A long-sleeved knit dress featuring a melange pattern in shades of dark grey, light grey, and white, with a rounded neckline. The dress has a relaxed fit and reaches approximately to the knee or just below, making it suitable for casual wear.","dress, knit dress, long sleeve, casual dress, melange knit, speckled, heathered, grey dress, winter dress, autumn dress, comfortable, everyday wear"
bcb839e0-9055-4760-b5a4-b7fd703b716f,dress/bcb839e0-9055-4760-b5a4-b7fd703b716f.jpg,dress,Casual / Utility,Rayon,UrbanElite,"A long-sleeved maxi shirt dress featuring a green, grey, black, and white camouflage pattern. It has a collared neckline, full-button front closure, and a tie-waist for a cinched silhouette. The sleeves have cuffs.","dress, maxi dress, shirt dress, long sleeve dress, camouflage, camo print, collared dress, tie waist, button front, casual dress, utility style, womens fashion, patterned dress"
be545b93-c60d-4be6-ae3a-64efd37b7fee,dress/be545b93-c60d-4be6-ae3a-64efd37b7fee.jpg,dress,Casual,Cotton blend,StyleSymphony,"A white sleeveless dress featuring a vibrant blue floral pattern with green leaves. It has a round neckline, a fitted bodice, and a gathered A-line skirt that falls to approximately knee-length. The dress has a light and airy feel, suitable for casual wear.","sleeveless dress, white dress, blue floral, summer dress, casual dress, knee-length dress, round neck, gathered skirt, women's fashion, floral print"
cbbe7c24-9d0a-4a7b-9680-af3c0f36b51f,dress/cbbe7c24-9d0a-4a7b-9680-af3c0f36b51f.jpg,dress,maxi,linen,StyleSense,"A stylish dress perfect for various occasions, featuring contemporary design and comfortable fit.","dress, women's fashion, apparel, clothing, casual, versatile"
d1369205-6113-4de7-bcad-c40a2b776037,dress/d1369205-6113-4de7-bcad-c40a2b776037.jpg,dress,Casual/Everyday,Lightweight woven fabric,UrbanElite,"A charming midi-length dress featuring short sleeves and a notched V-neckline with decorative buttons. The dress has a fitted waist with gentle gathering/pleats on the skirt, which includes functional side pockets. It is adorned with a vibrant, repeating pattern of blue, pink, and red circular floral motifs on a light peach/pink background, offering a cheerful and comfortable look.","Midi dress, Short sleeve dress, Floral pattern, Circular pattern, Pink dress, Blue accents, Red accents, Casual dress, Everyday wear, Spring dress, Summer dress, Lightweight fabric, Button detail, V-neck, Pleated skirt, Pockets, A-line dress"
de478f22-21f5-4992-a22a-edc084336fe8,dress/de478f22-21f5-4992-a22a-edc084336fe8.jpg,dress,mini,jersey,FashionFusion,"A fashionable dress designed for everyday wear, combining style and comfort.","dress, women's fashion, apparel, clothing, casual, versatile"
f246a9eb-ac60-4ed2-b815-e7887387a96a,dress/f246a9eb-ac60-4ed2-b815-e7887387a96a.jpg,dress,"Sleepwear, Casual",Cotton blend,EliteElegance,"An off-white slip dress or nightgown featuring thin spaghetti straps and a V-neckline. The garment is adorned with a delicate, repeating blue abstract pattern throughout. The hemline has a subtle wavy or scalloped edge. It appears to be made from a soft, comfortable fabric, suitable for sleepwear or casual wear.","slip dress, nightgown, sleepwear, casual dress, spaghetti strap, off-white, blue pattern, abstract print, womenswear, lingerie, mini dress"
f8aade97-3b1f-43d1-becb-9f12483fcc28,dress/f8aade97-3b1f-43d1-becb-9f12483fcc28.jpg,dress,Formal / Business Casual,Woven fabric,FashionFiesta,"A dark grey sleeveless sheath dress featuring a square neckline, a subtle micro-check pattern, and a tailored silhouette. The dress includes two functional front slip pockets and a hidden back zipper closure. Its professional design makes it suitable for office wear or business casual settings.","dress, sleeveless dress, sheath dress, pencil dress, grey dress, dark grey, formal dress, business casual dress, office wear, work dress, square neck, tailored dress, textured fabric, micro-check, pockets"
fdbc4a3c-4902-45ac-a10e-b641e3ebb0d4,dress/fdbc4a3c-4902-45ac-a10e-b641e3ebb0d4.jpg,dress,Casual,Lightweight fabric,TrendSet,"A casual, multi-colored maxi dress or sundress featuring a plaid or checkered pattern in shades of green, blue, and light yellow. The dress has a V-neckline and appears to be made of a lightweight, breathable fabric, suitable for warm weather. It is laid flat on a red surface.","dress, maxi dress, sundress, casual, plaid, checkered, green, blue, multi-color, summer, spring, women's fashion, apparel, clothing"
fe69a500-595a-4152-856a-5c4e537f8507,dress/fe69a500-595a-4152-856a-5c4e537f8507.jpg,dress,Casual,Jersey,H&M,"A dark blue (navy) short-sleeved casual dress or tunic featuring a large, stylized light grey/beige bow graphic print on the front. It has a round neckline with a tie-back detail at the nape, suggesting a relaxed and comfortable fit.","dress, short sleeve, navy blue, dark blue, bow print, graphic print, casual dress, tunic dress, women's fashion, knit dress, tie back detail, comfortable, feminine"
